{"schema":"receiptos.verify.bundle.v1","canonicalization_profile":"receiptos.verify.canonical-json.v1","statement":{"schema":"receiptos.verify.statement.v1","verification_profile":"receiptos.verify.git-artifact.v1","subject":{"kind":"git-artifact","id":"root-audit-A","artifact_digest":"809b4dae623397f52742fe92f5c5d5bd22fbedaf8fc3a587523188bb5b8fe14d","commit":"193f4f7434a007184c123933d9211d051faa03f9","tree":"9b9debc1bf1145346ab9917ade4d6bc5b4b1a3eb","artifact_path":"artifact.txt","version":"audit.v1"},"claim":{"kind":"SHA256_EQUALS","expected_digest":"809b4dae623397f52742fe92f5c5d5bd22fbedaf8fc3a587523188bb5b8fe14d"},"policy":{"id":"audit-policy","version":"audit.v1","digest":"75267c3a63712a9c6a5948977e8f16a6bd74fb0c430e1fa46c5ac8696680c4a1"},"semantic_contract":{"claim_type":"SHA256_EQUALS","authority_class":"INDEPENDENT_RECOMPUTATION","subject":"root-audit-A","scope":"artifact.txt","valid_after":0,"valid_until":2000000000,"assumptions":[],"evidence_requirements":["artifact","execution"]},"asserted_result":"PASS","evidence_manifest":[{"id":"artifact","role":"artifact","digest":"809b4dae623397f52742fe92f5c5d5bd22fbedaf8fc3a587523188bb5b8fe14d","size":32},{"id":"commit","role":"git-commit","digest":"1f75cfbd070056ea924a472d61f812b6e7d401e3ecbb154b26f5e8405e7779c6","size":220},{"id":"tree","role":"git-tree","digest":"a26811b06e3cf9345c09350bed14e7c329e6bd2ffbf54b03701fb364d20a4cd9","size":40},{"id":"result","role":"native-result","digest":"756e1adc03bafcb621f00988863d8bd1e0ce74d31896c21a84581484b157c97a","size":331}],"payload_digest":"3b846591a39801caa6296ac65305c3289db18d770ec2f9a7a7cd668c8a2f54f1","crypto":{"provider":"ed25519","key_id":"audit-ed25519"}},"signature_base64":"I7r9xPjK5YstNzu3qFXvp0uakL+LhxiDpjEPLg4sJR7TT4hsCwVqW0qBoyesLG9E2YsOtBJuwGcYJI8xuDZdAg==","evidence":[{"id":"artifact","bytes_base64":"RnJlc2ggYXVkaXQgYXJ0aWZhY3QgMjAyNi0xMC0xMQo="},{"id":"commit","bytes_base64":"dHJlZSA5YjlkZWJjMWJmMTE0NTM0NmFiOTkxN2FkZTRkNmJjNWI0YjFhM2ViCmF1dGhvciBSZWxlYXNlIEF1ZGl0b3IgPHN5bnRoZXRpY0BleGFtcGxlLmludmFsaWQ+IDE3OTE2NzY4MDAgKzAwMDAKY29tbWl0dGVyIFJlbGVhc2UgQXVkaXRvciA8c3ludGhldGljQGV4YW1wbGUuaW52YWxpZD4gMTc5MTY3NjgwMCArMDAwMAoKSW5kZXBlbmRlbnQgcmVsZWFzZSBkZW1vbnN0cmF0aW9uCg=="},{"id":"tree","bytes_base64":"MTAwNjQ0IGFydGlmYWN0LnR4dAAHVaWG59m/NEwupvbY6hGkgfKEPw=="},{"id":"result","bytes_base64":"eyJldmFsdWF0aW9uIjp7ImV2aWRlbmNlTWVtYmVyIjoiYXJ0aWZhY3QiLCJleHBlY3RlZERpZ2VzdCI6IjgwOWI0ZGFlNjIzMzk3ZjUyNzQyZmU5MmY1YzVkNWJkMjJmYmVkYWY4ZmMzYTU4NzUyMzE4OGJiNWI4ZmUxNGQiLCJvYnNlcnZlZERpZ2VzdCI6IjgwOWI0ZGFlNjIzMzk3ZjUyNzQyZmU5MmY1YzVkNWJkMjJmYmVkYWY4ZmMzYTU4NzUyMzE4OGJiNWI4ZmUxNGQiLCJvcGVyYXRpb24iOiJTSEEyNTZfRVFVQUxTIn0sIm91dGNvbWUiOiJWRVJJRklFRCIsInJlYXNvbkNvZGUiOiJydnIudjAuZGlnZXN0X21hdGNoIiwic2NoZW1hIjoicnZyLmNhbm9uaWNhbC1yZXN1bHQudjAifQ=="}],"payload":{"crystal":{"schema":"stealth.session.evidence.v1","session_id":"independent-release-audit","directory":"audit/synthetic","task":{"title":"Independent artifact audit"},"agent":{"id":"audit","runtime":"local"},"scope":{"permission":null},"execution":[],"commands":[],"changes":{"files_changed":[],"diff_sha256":null},"metadata":{"generated_by":"independent-auditor"},"anchor":{"receipt_root":"0xa6cf9fa0378b37c594d427de8f78f6d4e6a4b12a6711f4c8c42a26b74a87ba65","network":"local/off-chain","onchain_anchor_status":"not anchored"}},"rvr":{"originalBundle":{"receipt":{"claimDigest":"68e5642aa8f2bd115d97f93bbe98fc7c8c7390754316b73f3f756aa93216473b","evidenceSetDigest":"d4a076a3ac5b90bdeb2ad98a7e9fea161a75962396608c432bb27d00ecc5e033","verificationProfileDigest":"51f79442e96339ca45e9e6cc0c8232833efbee20e7480df00987dbc97da72948","outcome":"VERIFIED","reasonCode":"rvr.v0.digest_match","resultDigest":"756e1adc03bafcb621f00988863d8bd1e0ce74d31896c21a84581484b157c97a"},"claim":{"schema":"rvr.claim.sha256-equals.v0","operation":"SHA256_EQUALS","evidenceMember":"artifact","expectedDigest":"809b4dae623397f52742fe92f5c5d5bd22fbedaf8fc3a587523188bb5b8fe14d"},"evidenceSet":{"schema":"rvr.evidence-set.v0","members":[{"id":"artifact","status":"PRESENT","mediaType":"application/octet-stream","byteLength":"32","digest":"809b4dae623397f52742fe92f5c5d5bd22fbedaf8fc3a587523188bb5b8fe14d"}]},"payloadsBase64":{"artifact":"RnJlc2ggYXVkaXQgYXJ0aWZhY3QgMjAyNi0xMC0xMQo="},"verificationProfile":{"schema":"rvr.verification-profile.v0","profileId":"rvr-generic-sha256-equals-v0","profileSchemaContract":{"manifest":{"id":"verification-profile-manifest-schema","path":"conformance/rvr-v0/verification-profile-manifest.schema.json","sha256":"148afeb484d3866c1caae82e574182c1b748dd461dfaeb1d8095ecf4905690c1","requiredForRecomputation":true},"constraints":{"id":"rvr-generic-sha256-equals-profile-schema","path":"conformance/rvr-v0/rvr-generic-sha256-equals-v0.profile.schema.json","sha256":"ecded96c5f58f7057e2c5c0b6d9789942a9a7bf600f4a453387e99f8406e7baf","requiredForRecomputation":true}},"dependencyResolution":{"base":"SUPPLIED_PROFILE_PACKAGE_ROOT","pathFormat":"relative-posix-no-empty-dot-dotdot-or-colon-segments","locatorRole":"NORMATIVE_PACKAGE_RELATIVE_PATH","verificationOrder":"resolve-read-sha256-match-use"},"verificationSpecification":{"id":"verification-specification","path":"docs/spec/RECOMPUTABLE_VERIFICATION_RECEIPTS_V0.md","sha256":"81077ddbf50624bc70941cf53a4f542604e926a653d7fcb3a36310ff5430b973","requiredForRecomputation":true},"conformanceVectorSet":{"id":"rvr-v0-first-falsification-set","members":[{"id":"expected-results","path":"conformance/rvr-v0/expected.json","sha256":"0ed23ee3530df93dde2f879981d28ddb3f60fc250c8652d109dd65fdb22193ce","requiredForRecomputation":false},{"id":"adversarial-mutants","path":"conformance/rvr-v0/mutants.json","sha256":"d5d16cc53ec0d9be53968d7ffc01fe019cb8b2630390c04431f6ee9f54edf847","requiredForRecomputation":false},{"id":"verification-vectors","path":"conformance/rvr-v0/vectors.json","sha256":"170fc62576fa8edb22073f73b28d9ac0deff26451ef651378839cd458da7312f","requiredForRecomputation":false}],"digest":"2eb5e0c056d13c4beda4b3da6fafdcd34a6bd96479030e3914a79d08679c0687","digestRule":"sha256-utf8-sorted-path-tab-file-sha256-lf-rows"},"canonicalByteContract":{"id":"rvr-canonical-json-v0","encoding":"UTF-8","domain":"null-boolean-unicode-scalar-string-array-object","objectKeyOrder":"unicode-scalar-value-ascending","arrayOrder":"preserved-with-duplicates","unicode":"scalar-values-only-no-normalization","numbers":"forbidden","stringEscaping":"rvr-json-string-escaping-v0","solidus":"literal","lineSeparators":"U+2028-and-U+2029-literal","whitespace":"none"},"schemaContracts":[{"id":"rvr-schema","path":"conformance/rvr-v0/rvr.schema.json","sha256":"97799403d8eb96c046930396c39e0f1c3e76d6c35fd0435937446ce844bd4dae","requiredForRecomputation":true}],"evidenceSetContract":{"schemaPath":"conformance/rvr-v0/rvr.schema.json","schemaSha256":"97799403d8eb96c046930396c39e0f1c3e76d6c35fd0435937446ce844bd4dae","schemaPointer":"#/$defs/evidenceSet","digestRule":"sha256-utf8-rvr-canonical-json-v0-normalized-member-order"},"canonicalResultContract":{"schemaPath":"conformance/rvr-v0/rvr.schema.json","schemaSha256":"97799403d8eb96c046930396c39e0f1c3e76d6c35fd0435937446ce844bd4dae","schemaPointer":"#/$defs/canonicalResult","outcomeProjection":"/outcome","reasonCodeProjection":"/reasonCode"},"resultHashRules":{"algorithm":"SHA-256","input":"rvr-canonical-json-v0(canonicalResult)","encoding":"UTF-8-exactly-once","output":"lowercase-hex-no-prefix"},"reasonCodeNamespace":{"verification":["rvr.v0.digest_match","rvr.v0.digest_mismatch","rvr.v0.required_evidence_unavailable"],"recomputation":["rvr.recompute.identical","rvr.recompute.canonical_result_diverged","rvr.recompute.normative_dependency_unavailable","rvr.recompute.normative_dependency_identity_mismatch","rvr.recompute.committed_evidence_unavailable"],"gateRejections":["rvr.gate.schema_invalid","rvr.gate.identity_mismatch","rvr.gate.result_projection_mismatch","rvr.gate.evidence_closure_incomplete"]},"externalContextPolicy":{"mode":"FORBIDDEN_UNLESS_COMMITTED","ambientInputs":"FORBIDDEN","immutableCommitments":[]}},"canonicalResult":{"schema":"rvr.canonical-result.v0","outcome":"VERIFIED","reasonCode":"rvr.v0.digest_match","evaluation":{"operation":"SHA256_EQUALS","evidenceMember":"artifact","expectedDigest":"809b4dae623397f52742fe92f5c5d5bd22fbedaf8fc3a587523188bb5b8fe14d","observedDigest":"809b4dae623397f52742fe92f5c5d5bd22fbedaf8fc3a587523188bb5b8fe14d"}}},"candidateCase":{"claim":{"schema":"rvr.claim.sha256-equals.v0","operation":"SHA256_EQUALS","evidenceMember":"artifact","expectedDigest":"809b4dae623397f52742fe92f5c5d5bd22fbedaf8fc3a587523188bb5b8fe14d"},"evidenceSet":{"schema":"rvr.evidence-set.v0","members":[{"id":"artifact","status":"PRESENT","mediaType":"application/octet-stream","byteLength":"32","digest":"809b4dae623397f52742fe92f5c5d5bd22fbedaf8fc3a587523188bb5b8fe14d"}]},"payloadsBase64":{"artifact":"RnJlc2ggYXVkaXQgYXJ0aWZhY3QgMjAyNi0xMC0xMQo="}}},"relations":{"guarantee":null,"continuity":null,"domain":null,"execution":{"package_present":true,"runner_declared":true,"executed":true,"subject_digest":"357bd76c8b3aa0666139821eab0350f0fad62f8f16656b8aad4124ff7f14e743","executable_pin":"9dd36e882dd372f264b77b179130948aa5adcbde","evidence_grade":"LOCAL_RECOMPUTATION"}}}}
