{"schema":"receiptos.verify.bundle.v1","canonicalization_profile":"receiptos.verify.canonical-json.v1","statement":{"schema":"receiptos.verify.statement.v1","verification_profile":"receiptos.verify.git-artifact.v1","subject":{"kind":"git-artifact","id":"audit-�","artifact_digest":"41c8ba258666347859ce068adf4d4f5bcc8ad47ae09b80b1baf3c72dfee959b9","commit":"58fc9ec3eddbff00e3ee2cae01f6f9dc04f230fd","tree":"207f88d283e9a447f517c928ba1ed8a1b0a5e68d","artifact_path":"artifact.txt","version":"audit.v1"},"claim":{"kind":"SHA256_EQUALS","expected_digest":"41c8ba258666347859ce068adf4d4f5bcc8ad47ae09b80b1baf3c72dfee959b9"},"policy":{"id":"audit-policy","version":"audit.v1","digest":"247e61ab17d3a0b48f0911fe4d851e84b8331e4685e02975eb46af132578b0d8"},"semantic_contract":{"claim_type":"SHA256_EQUALS","authority_class":"INDEPENDENT_RECOMPUTATION","subject":"audit-�","scope":"artifact.txt","valid_after":0,"valid_until":2000000000,"assumptions":[],"evidence_requirements":["artifact","execution"]},"asserted_result":"PASS","evidence_manifest":[{"id":"artifact","role":"artifact","digest":"41c8ba258666347859ce068adf4d4f5bcc8ad47ae09b80b1baf3c72dfee959b9","size":14},{"id":"commit","role":"git-commit","digest":"c10925e9be1810365ae02fa424738d2ded66b512bb9e9c8b61b7ddaee0e5fe73","size":207},{"id":"tree","role":"git-tree","digest":"bb3bc24dfa36e354c4920ea97ce549ad7af01ebcfbdbe6a522c2e49f36a62f63","size":40},{"id":"result","role":"native-result","digest":"731d3b30036301737ce43593e4c344a2103ba335f9cf43a8c004ef9396976d17","size":331}],"payload_digest":"042201be6bd0c4a13b6a2a70facdb605cd14c6249f51d0c74ef53d667ea2bc84","crypto":{"provider":"ed25519","key_id":"audit-ed25519"}},"signature_base64":"kq3ZFeKOFqDYi3mkTfVRgY7KtRdIRVSGUYh6VHkFPyNx3AL9fsZjDPt4jWWkI72ctUucawMSIT93b+Mzm57lCA==","evidence":[{"id":"artifact","bytes_base64":"VVRGOCBhcnRpZmFjdAo="},{"id":"commit","bytes_base64":"dHJlZSAyMDdmODhkMjgzZTlhNDQ3ZjUxN2M5MjhiYTFlZDhhMWIwYTVlNjhkCmF1dGhvciBSZWxlYXNlIEF1ZGl0b3IgPHN5bnRoZXRpY0BleGFtcGxlLmludmFsaWQ+IDE3OTE2NzY4MDAgKzAwMDAKY29tbWl0dGVyIFJlbGVhc2UgQXVkaXRvciA8c3ludGhldGljQGV4YW1wbGUuaW52YWxpZD4gMTc5MTY3NjgwMCArMDAwMAoKVVRGOCBhZG1pc3Npb24gYXVkaXQK"},{"id":"tree","bytes_base64":"MTAwNjQ0IGFydGlmYWN0LnR4dABNdLDIR0J/Aa0ngsXXrVBa+KE6Fg=="},{"id":"result","bytes_base64":"eyJldmFsdWF0aW9uIjp7ImV2aWRlbmNlTWVtYmVyIjoiYXJ0aWZhY3QiLCJleHBlY3RlZERpZ2VzdCI6IjQxYzhiYTI1ODY2NjM0Nzg1OWNlMDY4YWRmNGQ0ZjViY2M4YWQ0N2FlMDliODBiMWJhZjNjNzJkZmVlOTU5YjkiLCJvYnNlcnZlZERpZ2VzdCI6IjQxYzhiYTI1ODY2NjM0Nzg1OWNlMDY4YWRmNGQ0ZjViY2M4YWQ0N2FlMDliODBiMWJhZjNjNzJkZmVlOTU5YjkiLCJvcGVyYXRpb24iOiJTSEEyNTZfRVFVQUxTIn0sIm91dGNvbWUiOiJWRVJJRklFRCIsInJlYXNvbkNvZGUiOiJydnIudjAuZGlnZXN0X21hdGNoIiwic2NoZW1hIjoicnZyLmNhbm9uaWNhbC1yZXN1bHQudjAifQ=="}],"payload":{"crystal":{"schema":"stealth.session.evidence.v1","session_id":"independent-release-audit","directory":"audit/synthetic","task":{"title":"Independent artifact audit"},"agent":{"id":"audit","runtime":"local"},"scope":{"permission":null},"execution":[],"commands":[],"changes":{"files_changed":[],"diff_sha256":null},"metadata":{"generated_by":"independent-auditor"},"anchor":{"receipt_root":"0xa6cf9fa0378b37c594d427de8f78f6d4e6a4b12a6711f4c8c42a26b74a87ba65","network":"local/off-chain","onchain_anchor_status":"not anchored"}},"rvr":{"originalBundle":{"receipt":{"claimDigest":"1049a012ebbadd312158b6acfe921a2057b0fdf74c2271d64a773f80fd4a95f5","evidenceSetDigest":"a4b0bf50b2db84d4b2dd0d13768d55f14ef7f87b47cbc7ca40ca07ed8d205260","verificationProfileDigest":"51f79442e96339ca45e9e6cc0c8232833efbee20e7480df00987dbc97da72948","outcome":"VERIFIED","reasonCode":"rvr.v0.digest_match","resultDigest":"731d3b30036301737ce43593e4c344a2103ba335f9cf43a8c004ef9396976d17"},"claim":{"schema":"rvr.claim.sha256-equals.v0","operation":"SHA256_EQUALS","evidenceMember":"artifact","expectedDigest":"41c8ba258666347859ce068adf4d4f5bcc8ad47ae09b80b1baf3c72dfee959b9"},"evidenceSet":{"schema":"rvr.evidence-set.v0","members":[{"id":"artifact","status":"PRESENT","mediaType":"application/octet-stream","byteLength":"14","digest":"41c8ba258666347859ce068adf4d4f5bcc8ad47ae09b80b1baf3c72dfee959b9"}]},"payloadsBase64":{"artifact":"VVRGOCBhcnRpZmFjdAo="},"verificationProfile":{"schema":"rvr.verification-profile.v0","profileId":"rvr-generic-sha256-equals-v0","profileSchemaContract":{"manifest":{"id":"verification-profile-manifest-schema","path":"conformance/rvr-v0/verification-profile-manifest.schema.json","sha256":"148afeb484d3866c1caae82e574182c1b748dd461dfaeb1d8095ecf4905690c1","requiredForRecomputation":true},"constraints":{"id":"rvr-generic-sha256-equals-profile-schema","path":"conformance/rvr-v0/rvr-generic-sha256-equals-v0.profile.schema.json","sha256":"ecded96c5f58f7057e2c5c0b6d9789942a9a7bf600f4a453387e99f8406e7baf","requiredForRecomputation":true}},"dependencyResolution":{"base":"SUPPLIED_PROFILE_PACKAGE_ROOT","pathFormat":"relative-posix-no-empty-dot-dotdot-or-colon-segments","locatorRole":"NORMATIVE_PACKAGE_RELATIVE_PATH","verificationOrder":"resolve-read-sha256-match-use"},"verificationSpecification":{"id":"verification-specification","path":"docs/spec/RECOMPUTABLE_VERIFICATION_RECEIPTS_V0.md","sha256":"81077ddbf50624bc70941cf53a4f542604e926a653d7fcb3a36310ff5430b973","requiredForRecomputation":true},"conformanceVectorSet":{"id":"rvr-v0-first-falsification-set","members":[{"id":"expected-results","path":"conformance/rvr-v0/expected.json","sha256":"0ed23ee3530df93dde2f879981d28ddb3f60fc250c8652d109dd65fdb22193ce","requiredForRecomputation":false},{"id":"adversarial-mutants","path":"conformance/rvr-v0/mutants.json","sha256":"d5d16cc53ec0d9be53968d7ffc01fe019cb8b2630390c04431f6ee9f54edf847","requiredForRecomputation":false},{"id":"verification-vectors","path":"conformance/rvr-v0/vectors.json","sha256":"170fc62576fa8edb22073f73b28d9ac0deff26451ef651378839cd458da7312f","requiredForRecomputation":false}],"digest":"2eb5e0c056d13c4beda4b3da6fafdcd34a6bd96479030e3914a79d08679c0687","digestRule":"sha256-utf8-sorted-path-tab-file-sha256-lf-rows"},"canonicalByteContract":{"id":"rvr-canonical-json-v0","encoding":"UTF-8","domain":"null-boolean-unicode-scalar-string-array-object","objectKeyOrder":"unicode-scalar-value-ascending","arrayOrder":"preserved-with-duplicates","unicode":"scalar-values-only-no-normalization","numbers":"forbidden","stringEscaping":"rvr-json-string-escaping-v0","solidus":"literal","lineSeparators":"U+2028-and-U+2029-literal","whitespace":"none"},"schemaContracts":[{"id":"rvr-schema","path":"conformance/rvr-v0/rvr.schema.json","sha256":"97799403d8eb96c046930396c39e0f1c3e76d6c35fd0435937446ce844bd4dae","requiredForRecomputation":true}],"evidenceSetContract":{"schemaPath":"conformance/rvr-v0/rvr.schema.json","schemaSha256":"97799403d8eb96c046930396c39e0f1c3e76d6c35fd0435937446ce844bd4dae","schemaPointer":"#/$defs/evidenceSet","digestRule":"sha256-utf8-rvr-canonical-json-v0-normalized-member-order"},"canonicalResultContract":{"schemaPath":"conformance/rvr-v0/rvr.schema.json","schemaSha256":"97799403d8eb96c046930396c39e0f1c3e76d6c35fd0435937446ce844bd4dae","schemaPointer":"#/$defs/canonicalResult","outcomeProjection":"/outcome","reasonCodeProjection":"/reasonCode"},"resultHashRules":{"algorithm":"SHA-256","input":"rvr-canonical-json-v0(canonicalResult)","encoding":"UTF-8-exactly-once","output":"lowercase-hex-no-prefix"},"reasonCodeNamespace":{"verification":["rvr.v0.digest_match","rvr.v0.digest_mismatch","rvr.v0.required_evidence_unavailable"],"recomputation":["rvr.recompute.identical","rvr.recompute.canonical_result_diverged","rvr.recompute.normative_dependency_unavailable","rvr.recompute.normative_dependency_identity_mismatch","rvr.recompute.committed_evidence_unavailable"],"gateRejections":["rvr.gate.schema_invalid","rvr.gate.identity_mismatch","rvr.gate.result_projection_mismatch","rvr.gate.evidence_closure_incomplete"]},"externalContextPolicy":{"mode":"FORBIDDEN_UNLESS_COMMITTED","ambientInputs":"FORBIDDEN","immutableCommitments":[]}},"canonicalResult":{"schema":"rvr.canonical-result.v0","outcome":"VERIFIED","reasonCode":"rvr.v0.digest_match","evaluation":{"operation":"SHA256_EQUALS","evidenceMember":"artifact","expectedDigest":"41c8ba258666347859ce068adf4d4f5bcc8ad47ae09b80b1baf3c72dfee959b9","observedDigest":"41c8ba258666347859ce068adf4d4f5bcc8ad47ae09b80b1baf3c72dfee959b9"}}},"candidateCase":{"claim":{"schema":"rvr.claim.sha256-equals.v0","operation":"SHA256_EQUALS","evidenceMember":"artifact","expectedDigest":"41c8ba258666347859ce068adf4d4f5bcc8ad47ae09b80b1baf3c72dfee959b9"},"evidenceSet":{"schema":"rvr.evidence-set.v0","members":[{"id":"artifact","status":"PRESENT","mediaType":"application/octet-stream","byteLength":"14","digest":"41c8ba258666347859ce068adf4d4f5bcc8ad47ae09b80b1baf3c72dfee959b9"}]},"payloadsBase64":{"artifact":"VVRGOCBhcnRpZmFjdAo="}}},"relations":{"guarantee":null,"continuity":null,"domain":null,"execution":{"package_present":true,"runner_declared":true,"executed":true,"subject_digest":"038ed105cc7b1d41eec6dfd279e6ece6f0bec96c36b243e10fe41cb65c74e0fb","executable_pin":"9dd36e882dd372f264b77b179130948aa5adcbde","evidence_grade":"LOCAL_RECOMPUTATION"}}}}
